{
  "schema_version": "1.0",
  "record_type": "dataset_version",
  "tenant_id": "018f0000-0000-7000-8000-000000000001",
  "dataset_id": "018f0000-0000-7000-8000-00000000001d",
  "revision": 1,
  "target_scope": {
    "schema_version": "1.0",
    "record_type": "memory_scope",
    "scope_id": "018f0000-0000-7000-8000-000000000005",
    "tenant_id": "018f0000-0000-7000-8000-000000000001",
    "actor_id": "018f0000-0000-7000-8000-000000000002",
    "parent_record_type": "actor_context",
    "parent_digest": "sha256:eaa0f1c67d60a24074f87d824ec6267bf04ca492ff330844c17ee715e4fa08df",
    "selection": {
      "level": "project",
      "project_id": "018f0000-0000-7000-8000-00000000002e"
    },
    "derived_at": "2026-01-01T00:00:02.000Z",
    "valid_until": "2026-01-01T01:00:00.000Z"
  },
  "lifecycle_state": "published",
  "source_revisions": [
    {
      "record_type": "learning_trace_envelope",
      "record_id": "018f0000-0000-7000-8000-000000000009",
      "record_digest": "sha256:dbeecf3b1a995b908d21f3eb8c7b9a01790b20d94da0925cd54edf2751dfb41f"
    }
  ],
  "consent_policy_id": "consent.v1",
  "redaction_policy_id": "redaction.v1",
  "split_assignments": {
    "train": [
      "018f0000-0000-7000-8000-00000000001e"
    ],
    "validation": [
      "018f0000-0000-7000-8000-00000000001f"
    ],
    "test": [
      "018f0000-0000-7000-8000-000000000020"
    ]
  },
  "exclusions": [],
  "producer_version": "producer.v1",
  "runtime_version": "runtime.v1",
  "policy_refs": [
    {
      "record_type": "policy_proposal",
      "record_id": "018f0000-0000-7000-8000-00000000005a",
      "record_digest": "sha256:0a2e5f05be4f91c4ce301cd0d57ea112eed02bb71bad73c69f34ce3e7ca38f9c"
    }
  ],
  "reviewer_refs": [
    {
      "record_type": "approval_record",
      "record_id": "018f0000-0000-7000-8000-000000000017",
      "record_digest": "sha256:12bed50694285a872224ca05220a0df245559ca5898a753a0a0a5e933bd283cb"
    }
  ],
  "compatibility": {
    "contract_versions": [
      "dataset_version=1.0"
    ],
    "runtime_version_range": ">=1.0"
  },
  "created_at": "2026-01-01T00:15:00.000Z",
  "published_at": "2026-01-01T00:16:00.000Z",
  "manifest_digest": "sha256:cc304be081da08786b54fdd9c9113ccf7013b2561d3fafbeb4399b802a5e45f1"
}
